{
  "schema": "ophiolite.contract-profile/1",
  "id": "petrel-faultsticks/1",
  "kind": "source",
  "lifecycle": "preview",
  "display_name": "Fault sticks (Petrel)",
  "description": "A Petrel fault-stick export (INLINE- inline crossline x y z fault stick) with the .crsmeta.xml beside it, kept byte for byte and read without an import recipe; each run of rows with one fault name and stick number is a stick, in file order.",
  "serves": [
    "ophiolite.scientific-asset/1"
  ],
  "connector": {
    "scientific_profile": "polyline-set-source/1",
    "source_schema": "Petrel/fault-sticks/INLINE-x-y-z-fault-stick",
    "mapping_version": "polyline-set/1",
    "history": "retained-exact-read"
  },
  "role": "artifact",
  "media_types": [
    "text/plain"
  ],
  "normalized_profile": "ophiolite.polyline-set/1",
  "context_schema": "ophiolite.typed-context/1",
  "package": "without-recipe",
  "representation_rules": {
    "artifact_kind_by_origin": {
      "source-reference": "original",
      "retained-capture": "original",
      "managed-derived": "derived-artifact"
    },
    "normalized": 1,
    "total": 2
  },
  "table_target": {
    "none": "not-a-table"
  }
}
