{
  "schema": "ophiolite.contract-profile/1",
  "id": "ophiolite/scalar-map/1",
  "kind": "normalized",
  "lifecycle": "preview",
  "display_name": "Regular scalar map (native exchange)",
  "description": "A regular row-major grid of numeric samples with explicit units, coordinate unit and CRS status; the native protobuf exchange form.",
  "payload_schema": "ophiolite/scalar-map/1",
  "role": "normalized",
  "media_types": [
    "application/json"
  ],
  "table_target": {
    "none": "not-a-table"
  }
}
