{
  "schema": "ophiolite.contract-profile/1",
  "id": "ophiolite.point-set/2",
  "kind": "normalized",
  "lifecycle": "preview",
  "display_name": "Recipe-read point set",
  "description": "Every point in file order (missing z null) with number, text and category attributes, each field of context taken from a recorded decision.",
  "payload_schema": "ophiolite.point-set/2",
  "role": "normalized",
  "media_types": [
    "application/json"
  ],
  "mappings": [
    "ophiolite.mapping/typed-standards/1"
  ],
  "table_target": {
    "none": "normalized-form"
  }
}
