{
  "schema": "ophiolite.contract-profile/1",
  "id": "edited-wells/1",
  "kind": "source",
  "lifecycle": "preview",
  "display_name": "Edited well locations (retained result)",
  "description": "A retained, exactly readable result of editing well records in a saved draft.",
  "connector": {
    "scientific_profile": "well-location/1",
    "source_schema": "ophiolite.edited-wells/1",
    "mapping_version": "edited-wells/1",
    "history": "retained-exact-read"
  },
  "role": "artifact",
  "media_types": [
    "application/json"
  ],
  "table_target": {
    "none": "not-a-table"
  }
}
