{
  "schema": "ophiolite.contract-profile/1",
  "id": "geojson/1",
  "kind": "source",
  "lifecycle": "preview",
  "display_name": "Map features (GeoJSON)",
  "description": "A GeoJSON feature or feature collection (RFC 7946, or the older form whose crs member names EPSG), kept byte for byte; coordinates as stored.",
  "serves": [
    "ophiolite.scientific-asset/1"
  ],
  "connector": {
    "scientific_profile": "feature-set-source/1",
    "source_schema": "GeoJSON/RFC7946",
    "mapping_version": "feature-set/1",
    "history": "retained-exact-read"
  },
  "role": "artifact",
  "media_types": [
    "application/geo+json"
  ],
  "normalized_profile": "ophiolite.feature-set/1",
  "context_schema": "ophiolite.typed-context/1",
  "representation_rules": {
    "artifact_kind_by_origin": {
      "source-reference": "original",
      "retained-capture": "original",
      "managed-derived": "derived-artifact"
    },
    "normalized": 1,
    "total": 2
  },
  "table_target": {
    "none": "not-a-table"
  }
}
